listing_id,manufacturer,model,region,image_url,description,condition,state_id,posting_date,mileage,status,price,owner_id,rent_time
7304209003,ford,escape,st cloud,https://images.craigslist.org/00c0c_kvvVHE9AHVDz_0x20oM_600x450.jpg,"2019 Ford Escape 4D SE EcoBoost 4WD with 27,000 miles. Excellent condition. With aluminum/alloy wheels, blind spot monitor, lane departure warning, remote and app starter, parking aid, back up camera, smart and safe package, collision avoidance system, adaptive cruise control and 2.4L EcoBoost engine and factory warranty.",excellent,mn,2023-10-02 01:32:37,87830,active,5.962523675879584,59def556,7
7310291957,toyota,camry,huntsville / decatur,https://images.craigslist.org/00f0f_jYADxCTwmjoz_0ak07K_600x450.jpg,"2009 Toyota Camry Base CE -- $9,634       â˜Ž Call: (256) 261-1263  ext 10059  Vehicle Information: 2009 Toyota Camry Base CEPrice:  $9,634    Year:  2009*      Make:  *Toyota**      Model:  *Camry**      Series:  *Base CE**      Body Style:  Sedan*    Stock Number:  21M0066A    VIN:  4T1BE46K79U298817    Mileage:  98,799    Engine:  2.4L I4 SMPI DOHC    Transmission:  5-Speed    Exterior Color:  Gold*    Interior Color:  Our finance department is staffed with a team of friendly professionals who are dedicated to helping you find a finance plan that you feel confident about. Whether you're planning on taking out a car loan or want to put together a personalized car lease, they'll work with you to ensure that you get exactly what you need out of a payment plan. Copy and paste this link to begin:  http://aswt.co/da9rl             For more details, pictures and information on this ***Toyota**** ***Camry**** ***Base CE****, Paste the link below into your browser:                http://aswt.co/da9rk                 Vehicle Options For This *Toyota** *Camry**:                             âœ… Sedan*                âœ… 4-Wheel Disc Brakes                âœ… 6 Speakers                âœ… 6.5JJ x 16 Steel Wheels                âœ… ABS brakes                âœ… AM/FM radio                âœ… Air Conditioning                âœ… Brake assist                âœ… Bumpers: body-color                âœ… CD player                âœ… Delay-off headlights                âœ… Driver door bin                âœ… Driver vanity mirror                âœ… Dual front impact airbags                âœ… Dual front side impact airbags                âœ… Four wheel independent suspension                âœ… Front Bucket Seats                âœ… Front Center Armrest                âœ… Front anti-roll bar                âœ… Front reading lights                âœ… Fully automatic headlights                âœ… Illuminated entry                âœ… Knee airbag                âœ… Low tire pressure warning                âœ… Meteor Fabric Seat Trim                âœ… Occupant sensing airbag                âœ… Outside temperature display                âœ… Overhead airbag                âœ… Overhead console                âœ… Passenger door bin                âœ… Passenger vanity mirror                âœ… Power door mirrors                âœ… Power steering                âœ… Power windows                âœ… Rear anti-roll bar                âœ… Rear seat center armrest                âœ… Rear window defroster                âœ… Speed control                âœ… Speed-sensing steering                âœ… Split folding rear seat                                                        â˜Ž Call (256) 261-1263  ext 10059   to find out more about this ***Toyota**** ***Camry****.                -or-                          Paste the link below into your browser to get more detailed information about this ____Toyota*____Camry*____Base CE*:                        http://aswt.co/da9rk                                     Call  us today and mention that you heard about this vehicle on Craigslist!                         Bill Penney Toyota            â˜Ž Phone Number: (256) 261-1263  ext 10059                          Additional Vehicle Information:                                     Gold 2009 Toyota Camry FWD 5-Speed 2.4L I4 SMPI DOHC Cloth.Recent Arrival! Odometer is 49024 miles below market average! 21/31 City/Highway MPGAwards: * 2009 KBB.com Brand Image AwardsHome of the $5,000 test drive! Visit us at www.billpenneytoyota.com or come by and see us for details!Reviews: * * Outstanding quality * Excellent resale value * Proven record of reliability * More rear head room than the Accord * Available Hybrid Source: KBB.com                                                             2009, 09, '09, Camry, Base CE, 4 Door Car, Sedan, Bill Penney Toyota, *Bill* *Penney* *Toyota*, ~as4683_cl261~Powered by AutoSweet | www.autosweet.com",good,al,2024-04-08 07:29:24,110810,active,42.43128535116581,34a358d4,29
7315233417,gmc,sierra 3500hd,topeka,https://images.craigslist.org/00B0B_dGDUV4xvlF1z_0jm0cT_600x450.jpg,"âž”Â Â Â Want to see more pictures?Â Paste this link toÂ VIEW MORE DETAILED PHOTOS: https://www.jimfalk.com/auto/used-2016-gmc-sierra-3500hd-denali-4x4-4wd-srw-duramax-diesel-nav-heated-cooled-leather-camera-summit-white-crew-cab-for-sale-clinton-mo/55353011/ðŸ’²Â Â Â Want to get the lowest price?Â Paste this link to get yourÂ EPRICE:Â Â https://jimfalk.fatwin.com/vehicleofinterest/WebThank you for clicking on our vehicle!! We are confident you found the BEST VEHICLE at the BEST DEALERSHIP! And we would love the opportunity to EARN your business. From standing behind our vehicles, to making the buying process easier than you have ever experienced with a NO OBLIGATION HOME DELIVERY, to putting up ridiculously detailed photos online for your at home (hopefully in your PJ's) viewing pleasurewe aim for 110% customer satisfaction! BUYING ONLINE has never been better you can view, purchase, and have your vehicle delivered while never leaving your house (or changing out of your pj's). Plus, we have a Director of Happiness call you after the sale TO BE SURE YOU LOVE YOUR VEHICLE AND YOUR EXPERIENCE WITH US!!4X4 PLUS 6.6L V8 DURAMAX DIESEL! ALLISON 6-SPEED AUTOMATIC TRANSMISSION AND 18 INCH RIMS! HEATED AND COOLED LEATHER PLUS DUAL ZONE CLIMATE CONTROL! SUNROOF AND NAVIGATION! BLUETOOTH PLUS CAMERA! SPRAY-ON BEDLINER AND TRAILER BRAKE CONTROLLER! I just completed a FULL LIVE WALK THROUGH of this TOUGH Summit White 2016 GMC Sierra 3500HD Denali 4WD SRW Crew Cab Standard Pickup Truck! I started up this 3500 with its REMOTE VEHICLE START system for the key fob, unlocked the driver door using the REMOTE KEYLESS ENTRY button on the key fob, opened the driver door, stepped up on 6 inch tubular CHROME ASSIST STEPS, and into the driver bucket seat. I was HIGHLY impressed to see that the driver and front passenger seats are HEATED and COOLED LEATHER plus the front row is equipped with DUAL ZONE CLIMATE CONTROL so that the driver and front passenger can ride at their preferred temperatures! I looked up and was amazed to see that this Sierra has a POWER SUNROOF that let's in some natural sunlight and breeze from the sky above! This Denali has other excellent features including POWER door locks and windows, POWER sliding rear window, POWER adjustable pedals, DRIVER SEAT MEMORY settings, TRAILER BRAKE CONTROLLER, HEATED LEATHER WRAPPED steering wheel with MOUNTED AUDIO and PHONE CONTROLS, cruise control, universal garage door opener, lighted vanity visor mirrors, Intellilink infotainment system with a color touchscreen, NAVIGATION, BLUETOOTH connectivity for phone use and music streaming, REAR VISION CAMERA, AM/FM radio, CD player, wireless charging device, BOSE AUDIO SYSTEM, front and rear park assist system, plus other amazing driver alert package with features including FORWARD COLLISION ALERT that will warn a driver of an impending collision with a car or object directly in its forward path,   DEPARTURE WARNING, and safety seat alert! This Denali continues to impress the rest with qualities such as SPRAY-ON BEDLINER, EZ LIFT and LOWER plus REMOTE LOCKING TAILGATE, LED lighting in the cargo box, cornerstep rear bumper, and Denali CHROME Grille, AND it is always a bonus to purchase a DIESEL TRUCK still under POWERTRAIN WARRANTY until 11/18/2021 or 100,029 miles! For a more complete list of features on this TOUGH HD please call, email, or stop by today! All of our vehicles are inspected by our certified technicians using a 120 point inspection. We have THOUSANDS OF LOYAL and HAPPY CUSTOMERS FROM ACROSS THE UNITED STATES!! View their TESTIMONIALS under About Us on the main menu! Plus, ASK US ABOUT FREE SAME DAY DELIVERY options. We are located in Clinton, MO, just off of 7 HWY half way between Kansas City and Springfield! We also do NOT HAVE ANY DOCUMENTATION FEES, ADMIN FEES, PROCESSING FEES, SIMPLY NO FEES!Buy a New & Better Way with Our Online Driveplicity Program!âœ… LOWEST PRICES in the Nation!âœ… FREE SAME DAY DELIVERY TO YOUR FRONT DOOR!âœ… NO HIDDEN Doc Fees (Saving you $199-800+ OFF the top)! âœ… Our Sales Line is Open Until 9 PM!ðŸ‘‡ SHOPPING TOOLS ðŸ‘‡Â (Links are not clickable - must paste into browser)Shop our ENTIRE INVENTORY here from the comfort of your home: https://www.jimfalk.com/search/Get Your TRADE EVALUATED IN MINUTES Online: https://jimfalk.fatwin.com/trade/WebQUESTIONS On Our Simple Same Day Delivery?? We Do this Everyday! CONTACT US: https://www.jimfalk.com/contact-us/Are you a PAYMENT BUYER?? Let's Figure Out If This Vehicle Fits in Your Budget - APPLY FOR FINANCING: https://www.jimfalk.com/finance-application/ (Links are not clickable - must paste into browser)â˜Ž Call Our Craigslist Specialists @ (785) 560-3256**A GREAT place to start is VALUING YOUR TRADE! Get TOP VALUE for your vehicle here: https://jimfalk.fatwin.com/trade/WebIs this vehicle not exactly what you are looking for? Find way more where this came from!â–¶ SHOP YOUR DESIRED PRICE RANGE!!â—€Â (Links are not clickable - must paste into browser)$20,001-$30,000: https://www.jimfalk.com/search/clinton-mo/?cy=64735&pr=0:20000$30,001-$40,000: https://www.jimfalk.com/search/clinton-mo/?cy=64735&pr=20001:40000&pr=0:20000$40,001-$50,000: https://www.jimfalk.com/search/clinton-mo/?cy=64735&pr=40001:60000&pr=20001:40000&pr=0:20000$50,001-$90,000: https://www.jimfalk.com/search/clinton-mo/?s:pr=0&cy=64735&pr=80001:100000&pr=60001:80000&pr=40001:60000&pr=20001:40000&pr=0:20000(Link is not clickable - must paste into browser)Vehicle Details:Year: 2016Make: *GMC*Transmission: automaticModel: *Sierra 3500HD*Trim: *Denali 4X4 4WD SRW Duramax Diesel Nav Heated Cooled Leather Camera Summit White *Bodystyle: *pickup*Exterior Color: WhiteInterior Color: Engine:   cylDrivetrain: 4wdMileage: 72297Stock #: C1292B~ 2016 *GMC* *Sierra 3500HD* *Denali 4X4 4WD SRW Duramax Diesel Nav Heated Cooled Leather Camera Summit White * *pickup*.*56687* *56,687* *56687.00* *$56687* *$56,687* *$56687.00* *$ 56687* *$ 56,687* *$ 56687.00* *2016* *16* *2016 GMC Sierra 3500HD* *2016-GMC-Sierra-3500HD* *2016GMCSierra3500HD* *2016 GMC* *2016-GMC* *2016GMC* *2016 Sierra* *2016-Sierra* *2016Sierra* *2016 3500HD* *2016-3500HD* *20163500HD* *GMC* *GMC Sierra* *GMC-Sierra* *GMCSierra* *GMC 3500HD* *GMC-3500HD* *GMC3500HD* *Sierra* *Sierra 3500HD* *Sierra-3500HD* *Sierra3500HD* *3500HD* *Denali 4X4 4WD SRW Duramax Diesel Nav Heated Cooled Leather Camera Summit White * *Denali-4X4-4WD-SRW-Duramax-Diesel-Nav-Heated-Cooled-Leather-Camera-Summit-White-* *Denali4X44WDSRWDuramaxDieselNavHeatedCooledLeatherCameraSummitWhite* *Denali* *Denali 4X4* *Denali-4X4* *Denali4X4* *Denali 4WD* *Denali-4WD* *Denali4WD* *Denali SRW* *Denali-SRW* *DenaliSRW* *Denali Duramax* *Denali-Duramax* *DenaliDuramax* *Denali Diesel* *Denali-Diesel* *DenaliDiesel* *Denali Nav* *Denali-Nav* *DenaliNav* *Denali Heated* *Denali-Heated* *DenaliHeated* *Denali Cooled* *Denali-Cooled* *DenaliCooled* *Denali Leather* *Denali-Leather* *DenaliLeather* *Denali Camera* *Denali-Camera* *DenaliCamera* *Denali Summit* *Denali-Summit* *DenaliSummit* *Denali White* *Denali-White* *DenaliWhite* *4X4* *4X4 4WD* *4X4-4WD* *4X44WD* *4X4 SRW* *4X4-SRW* *4X4SRW* *4X4 Duramax* *4X4-Duramax* *4X4Duramax* *4X4 Diesel* *4X4-Diesel* *4X4Diesel* *4X4 Nav* *4X4-Nav* *4X4Nav* *4X4 Heated* *4X4-Heated* *4X4Heated* *4X4 Cooled* *4X4-Cooled* *4X4Cooled* *4X4 Leather* *4X4-Leather* *4X4Leather* *4X4 Camera* *4X4-Camera* *4X4Camera* *4X4 Summit* *4X4-Summit* *4X4Summit* *4X4 White* *4X4-White* *4X4White* *4WD* *4WD SRW* *4WD-SRW* *4WDSRW* *4WD Duramax* *4WD-Duramax* *4WDDuramax* *4WD Diesel* *4WD-Diesel* *4WDDiesel* *4WD Nav* *4WD-Nav* *4WDNav* *4WD Heated* *4WD-Heated* *4WDHeated* *4WD Cooled* *4WD-Cooled* *4WDCooled* *4WD Leather* *4WD-Leather* *4WDLeather* *4WD Camera* *4WD-Camera* *4WDCamera* *4WD Summit* *4WD-Summit* *4WDSummit* *4WD White* *4WD-White* *4WDWhite* *SRW* *SRW Duramax* *SRW-Duramax* *SRWDuramax* *SRW Diesel* *SRW-Diesel* *SRWDiesel* *SRW Nav* *SRW-Nav* *SRWNav* *SRW Heated* *SRW-Heated* *SRWHeated* *SRW Cooled* *SRW-Cooled* *SRWCooled* *SRW Leather* *SRW-Leather* *SRWLeather* *SRW Camera* *SRW-Camera* *SRWCamera* *SRW Summit* *SRW-Summit* *SRWSummit* *SRW White* *SRW-White* *SRWWhite* *Duramax* *Duramax Diesel* *Duramax-Diesel* *DuramaxDiesel* *Duramax Nav* *Duramax-Nav* *DuramaxNav* *Duramax Heated* *Duramax-Heated* *DuramaxHeated* *Duramax Cooled* *Duramax-Cooled* *DuramaxCooled* *Duramax Leather* *Duramax-Leather* *DuramaxLeather* *Duramax Camera* *Duramax-Camera* *DuramaxCamera* *Duramax Summit* *Duramax-Summit* *DuramaxSummit* *Duramax White* *Duramax-White* *DuramaxWhite* *Diesel* *Diesel Nav* *Diesel-Nav* *DieselNav* *Diesel Heated* *Diesel-Heated* *DieselHeated* *Diesel Cooled* *Diesel-Cooled* *DieselCooled* *Diesel Leather* *Diesel-Leather* *DieselLeather* *Diesel Camera* *Diesel-Camera* *DieselCamera* *Diesel Summit* *Diesel-Summit* *DieselSummit* *Diesel White* *Diesel-White* *DieselWhite* *Nav* *Nav Heated* *Nav-Heated* *NavHeated* *Nav Cooled* *Nav-Cooled* *NavCooled* *Nav Leather* *Nav-Leather* *NavLeather* *Nav Camera* *Nav-Camera* *NavCamera* *Nav Summit* *Nav-Summit* *NavSummit* *Nav White* *Nav-White* *NavWhite* *Heated* *Heated Cooled* *Heated-Cooled* *HeatedCooled* *Heated Leather* *Heated-Leather* *HeatedLeather* *Heated Camera* *Heated-Camera* *HeatedCamera* *Heated Summit* *Heated-Summit* *HeatedSummit* *Heated White* *Heated-White* *HeatedWhite* *Cooled* *Cooled Leather* *Cooled-Leather* *CooledLeather* *Cooled Camera* *Cooled-Camera* *CooledCamera* *Cooled Summit* *Cooled-Summit* *CooledSummit* *Cooled White* *Cooled-White* *CooledWhite* *Leather* *Leather Camera* *Leather-Camera* *LeatherCamera* *Leather Summit* *Leather-Summit* *LeatherSummit* *Leather White* *Leather-White* *LeatherWhite* *Camera* *Camera Summit* *Camera-Summit* *CameraSummit* *Camera White* *Camera-White* *CameraWhite* *Summit* *Summit White* *Summit-White* *SummitWhite* *White*  This vehicle is located and easily accessible near the following cities: Overland Park, Kansas , KS, Wichita, Olathe, Lawrence, Shawnee, Mahattan, Lenexa, Salina, Hutchison, Leavenworth, Leawood,  , Emporia, Junct , Liberal, Derby, and Garden . *Jim Falk, Jim Falk Motors, *Front Wheel Drive* *All Wheel Drive* *4 Doors* *Doors* *Bad Credit* *Bankruptcy* *First time buyer*, *Auto Nat* ** *Automotive* *Lithia* ** *Group 1* *Penske* **, lease, cheap, afable, reliable, use, car, cars, truck, trucks, van, vans, suv, suvs, auto, dealer, dealers, dealerships, buy here pay here, *BHPH*,financing, drivetime, drive time, low, no, bad, poor, credit, malo, mal, credito, sale, sales, in house, Bad Credit Car Loan Loans / Finance /Financing / Instant / Fast / EZ / Easy / Group / Online / Internet / Approve / Approval / Quick / Special / Issues / Deal / Deals / Ap. / Ap / Apply / Applicat / Cheap / Check / Carfax / Import / ** *SE* *SE 4dr SUV 4WD* *Bad Credit* *For Sale* *Clean* *Cheap* *Used* *Like New* / Dealers / Approved / Condit / Low / Motors / Miles / Mile / Mileage / Dealer / used / Wheels / Wheel / Drive / Sign / Today / Now / Vehicle / Se / Seating / Seat / Auto / Inter / Exter / Warranty / Mal Credito, *BAD* *Credit* *Finance* *Financing* *Loan* *BHPH FREE*, *Car Fax*, FICO, BEACON, CREDIT, INSTANT, INSTANT APPROVAL, NO MONEY, NO MONEY DOWN, 0, $0 MONEY, *$1*,0 DOWN, $0 DOWN, LOW PAYMENTS, IBLE PAYMENTS, FUEL EFFICIENT, FAMILY SIZE, , , TRUCK, , COLORS, MILES, MILEAGE, FAMILY, SINGLE, FACTORY, REBATE, REBATES, LOCAL *no credit* *Espanol* *Habla espanol* *ITIN* *Pas* *For Sale* *Clean* *Cheap* *Used* *Certified* *pre-owned* *Preowned* *Pre owned* *Like New* *fair* *good* *great*. *AWD* *front wheel drive* *4 wheel drive* *4x4* *Diesel* *small car* *compact* *New* *mid-size car* *large cars* *suv* *truck* *car* ** *. *all prices* *all makes* *all models* *all years*, *2005* *2006* *2007* *2008* *2009* *2010* *2011* *2012* *2013* *2014* *2015* *2016* *2017* *2018* *2019* 1990 *1991* *91* *1992* *92* *1993* *93* *1994* *94* *1995* *95* *1996* *96* *1997* *97* *1998* *98* *1999* *99* *2000* *00* *2001* *01* *2002* *02* *2003* *03* *2004* *04* *2005* *05* *2006* *06* *2007* *07* *2008* *08* *2009* *09* *2010* *10* *2011* *11* *2012* *12* *2013* *13* *2014* *14* *2015* *15* *2016* *16* *2017* *17* *2018* *18* *2019* *19* *2020* *20* *2021* *21*   Bad Credit Bankruptcy First time buyer no credit For Sale Clean Cheap Used pre-owned Like New fair good great. Bad Credit Bankruptcy First time buyer, lease, cheap, afable, reliable, use, auto, dealer, dealers, dealerships, buy here pay here, BHPH,financing, drivetime, drive time, low, no, bad, poor, credit, malo, mal, credito, sale, sales, in house, Bad Credit Car Loan Loans / Finance /Financing / Instant / Fast / EZ / Easy / Group / Online / Internet / Approve / Approval / Quick / Special / Issues / Deal / Deals / Ap. / Ap / Apply / Applicat / Cheap / Check / Carfax / Import /  SE SE 4dr SUV 4WD Bad Credit For Sale Clean Cheap Used Like New / Dealers / Approved / Condit / Low / Motors / Miles / Mile / Mileage / Dealer / used / Wheels / Wheel / Drive / Sign / Today / Now / Vehicle / Se / Seating / Seat / Auto / Inter / Exter / Warranty / Mal Credito, BAD Credit Finance Financing Loan BHPH FREE, FICO, BEACON, CREDIT, INSTANT, INSTANT APPROVAL, NO MONEY, NO MONEY DOWN, 0, $0 MONEY, $1,0 DOWN, $0 DOWN, LOW PAYMENTS, IBLE PAYMENTS, FUEL EFFICIENT, , COLORS, MILES, MILEAGE, SINGLE, FACTORY, REBATE, REBATES, LOCAL no credit Espanol Habla espanol ITIN Pas For Sale Clean Cheap Used Certified pre-owned Preowned Pre owned Like New fair good great. all prices all makes all models all years Front Wheel Drive All Wheel Drive 4 Doors Doors, Auto Nat  Automotive Lithia  Group 1 Penske  lease, cheap afable reliable use, car, cars, truck, trucks, van, vans, suv, suvs, auto, dealer, dealers, dealerships, BHPH, drivetime, drive time,  SE SE 4dr SUV 4WD Motors / Miles / Mile / Mileage / Dealer / used / Wheels / Wheel / Drive / Sign / Today / Now / Vehicle / Se / Seating / Seat / Auto / Inter / Exter / Warranty / FUEL EFFICIENT, FAMILY SIZE, , , TRUCK, , COLORS, MILES, MILEAGE, FAMILY, SINGLE, FACTORY, REBATE, REBATES, Used Certified pre-owned Preowned Pre owned Like New fair good great. AWD front wheel drive 4 wheel drive 4x4 Diesel small car compact New mid-size car large cars suv truck.",good,ks,2024-04-27 03:47:56,58460,inactive,24.479760345645495,a0ae68e7,14
7307664999,chevrolet,malibu,lincoln,https://images.craigslist.org/00808_c3QRw51MEJCz_04Q06s_600x450.jpg,"2015 Chevy Malibu LTZ  Black, W/ Black Leather Interior.  Only 44,000 miles.",like new,ne,2023-12-02 14:20:50,110203,active,30.51784567900487,a0ae68e7,10
7316551230,honda,civic,san diego,https://images.craigslist.org/00R0R_6xu0LEvSV1bz_0cU09G_600x450.jpg,"2018 Honda Civic LX * LOW MILES * 6 SPEED * LX 4dr Sedan 6M     Offered by: FINANCING AVAILABLE!!! â€” (760) 965-4480 â€” Text (or call) for price     - Good Credit/ Bad Credit/ No Credit Financing! We Have Numerous Lenders To Meet Your Specific Needs.  - First Time Buyers Approved! Let Us Help You Establish Your Credit!  - Military Discount Available!  - For FAST Approvals Fill Out Our Online Credit Application! * Copy this link into your browser:  https://www.rockstar-rides.com/credit-application  - Trade Ins Welcome! We buy Cars.  - Extended Warranties Available!  SUPER CLEAN, LOW MILES, RARE 6 SPEED MANUAL, TINTED WINDOWS, POWER WINDOWS AND DOOR LOCKS, BACK UP CAMERA, AUX/USB, BLUETOOTH, KEYLESS ENTRY, GAS SAVER, ROOMY, SPORTY AND FUN TO DRIVE.   FINANCING AVAILABLE!!!    Year: 2018 Make: Honda Model: Civic LX * LOW MILES * 6 SPEED * Series: LX 4dr Sedan 6M VIN: 2HGFC2E50JH523499 Stock #: 100985 Condition: Used  MPG: 31 city / 40 highway Exterior: Crystal Black Pearl Interior: Black Body: Sedan Transmission: 6 Speed Manual Engine: 2.0L I4 158hp 138ft. lbs. Drivetrain: fwd     ðŸ¥‡ðŸðŸ¥‡ðŸ Rockstar Rides ðŸðŸ¥‡ðŸðŸ¥‡ ðŸ“² â˜Žï¸ï¸ CALL OR TEXT US (760) 965-4480 ðŸ“² â˜Žï¸ï¸ ðŸ“ Good Credit/ Bad Credit/ No Credit Financing! We Have Numerous Lenders To Meet Your Specific Needs. ðŸ“ First Time Buyers Approved! Let Us Help You Establish Your Credit! ðŸ“Military Discount Available! ðŸ“ For FAST Approvals Fill Out Our Online Credit Application!  * Copy this link into your browser:  â†ª https://www.rockstar-rides.com/credit-application  ðŸ“ This  2018 Honda Civic LX * LOW MILES * 6 SPEED * LX 4dr Sedan 6M Is Detailed and Ready For A Test Drive! ðŸ“ Trade Ins Welcome! We buy Cars.   ðŸš— ! Extended Warranties Available! ðŸ“ƒ CarFax Reports Available On This 2018 Honda Civic LX * LOW MILES * 6 SPEED * LX 4dr Sedan 6M ðŸ“ Check Out More Inventory At:  â†ª http://www.rockstar-rides.com       More vehicle details: rockstar-rides.hammerwebsites.net/v/ZEKRbWXY     Address: 1036 S Santa Fe Ave Vista, CA 92083   Phone: (760) 965-4480     Website: www.rockstar-rides.com/      ðŸ“² â˜Žï¸ Call or text (760) 965-4480 for quick answers to your questions about this Honda Civic LX * LOW MILES * 6 SPEED * Your message will always be answered by a real human â€” never an automated system.     Disclaimer: FINANCING AVAILABLE!!! will never sell, share, or spam your mobile number. Standard text messaging rates may apply. All approvals are based on approved credit, finance charges may apply, must be currently employed for financing. Price, plus tax, license and doc fees      2018 Honda Civic LX * LOW MILES * 6 SPEED * LX 4dr Sedan 6M   7e6ddaec09314a9ab7ae6cf67664b0a5",excellent,ca,2023-11-30 00:09:23,115065,inactive,32.45408927740263,a0ae68e7,19
7315770787,ford,f350 xl diesel 4x4,el paso,https://images.craigslist.org/00R0R_3UKDmRzXyiWz_0t20CI_600x450.jpg,"2010 Deleted & Tuned F350 Deisel with low miles (only 138,000)   Was completely stock until 135,000 miles.  Runs ans drives really well. I just don't need it.  Clean title in hand.  Located on East Side, just off George Dieter.  This is a heater only truck. No A/C. The A/C system is about $410 at autozone.",good,tx,2024-02-27 03:41:15,12345,active,54.73759877438508,ea0e89f7,9
