listing_id,manufacturer,model,region,image_url,description,condition,state_id,posting_date,mileage,status,price,owner_id,rent_time
7303585413,alfa-romeo,romeo stelvio ti sport,santa fe / taos,https://images.craigslist.org/00J0J_lrL4weEiuZuz_0gw0co_600x450.jpg,"Carvana is the safer way to buy a car During these uncertain times, Carvana is dedicated to ensuring safety for all of our customers. In addition to our 100% online shopping and selling experience that allows all customers to buy and trade their cars without ever leaving the safety of their house, weâ€™re providing touchless delivery that make all aspects of our process even safer. Now, you can get the car you want, and trade in your old one, while avoiding person-to-person contact with our friendly advocates. There are some things that canâ€™t be put off. And if buying a car is one of them, know that weâ€™re doing everything we can to keep you keep moving while continuing to put your health safety, and happiness first. Vehicle Stock# 2000864047ðŸ“± Want to instantly check this carâ€™s availability? Call us at  505-370-9637Just text that stock number to 855-976-4304 or head to  and plug it into the search bar!Get PRE-QUALIFIED for your auto loan in 2 minutes - no hit to your credit:http://finance.carvanaauto.com/6718320-74688Looking for more cars like this one? We have 58 Alfa Romeo Stelvio in stock for as low as $26990!Why buy with Carvana? We have one standard: the highest. Take a look at just some of the qualifications all of our cars must meet before we list them.150-POINT INSPECTION: We put each vehicle through a 150-point inspection so that you can be 100% confident in its quality and safety. See everything that goes into our inspections at:NO REPORTED ACCIDENTS: We do not sell cars that have been in a reported accident or have a frame or structural damage.7 DAY TEST OWN MONEY BACK GUARANTEE: Every Carvana car comes with a 7-day money-back guarantee. Why? It takes more than 15-minutes to make a decision on your next car. Learn more about test owning at http://about.carvanaauto.comFLEXIBLE FINANCING, TRADE INS WELCOME: Weâ€™re all about real-time financing without the middle man. Need financing? Pick a combination of down and monthly payments that work for you. Have a trade-in? Weâ€™ll give you a value in 2 minutes. Check out everything about our financing at:http://finance.carvanaauto.com/6718320-74688COST SAVINGS: Carvana's business model has fewer expenses and no bloated fees compared to your local dealership. See how much we can save you at http://about.carvanaauto.comPREMIUM DETAIL: We go the extra mile so that your car is looking as good as new. There are a lot of specifics that we wonâ€™t list here (we wash, clean, buff, paint, polish, wax, seal), but trust us that when your car arrives, itâ€™s going to look sweet.Vehicle Info for Stock# 2000864047Trim: Ti Sport Utility 4D hatchbackMileage: 16k milesExterior Color: BlueInterior Color: BLACKEngine: 2.0L Turbo I4 280hp 306ft. lbs.Drive: awdTransmission: Automatic, 8-SpdVIN: ZASFAKBN6J7B76949Dealer Disclosure: Price excludes tax, title, and registration (which we handle for you).Disclaimer: You agree that by providing your phone number, Carvana, or Carvanaâ€™s authorized representatives*, may call and/or send text messages (including by using equipment to automatically dial telephone numbers) about your interest in a purchase, for marketing/sales purposes, or for any other servicing or informational purpose related to your account. You do not have to consent to receiving calls or texts to purchase from Carvana. While every reasonable effort is made to ensure the accuracy of the information for this Alfa Romeo Stelvio, we are not responsible for any errors or omissions contained in this ad. Please verify any information in question with Carvana at 505-370-9637*Including, but not limited to, Bridgecrest Credit Company, GO Financial and SilverRock Automotive.*Alfa* *Romeo* *Stelvio* 2022  2021  2020  2019  2018  2017  2016  2015  2014  2013  2012  2011  2010  2009  2008  2007  2006  2005  2004  2003  2002  2001  2000   22  21    19  18  17  16  15  14  13  12  11  10  09  08  07  06  05  04  03  02  01  00",good,nm,2024-03-14 21:21:22,172135,active,49.5667669331515,db9c33aa,5
7315066721,honda,civic ex,charlotte,https://images.craigslist.org/00d0d_6uZEaKbQjzSz_0ak07K_600x450.jpg,"Why Buy From Team Auto Group?At Team Auto Group, located in Salisbury, NC, we love what we do and want you to love your next vehicle. That is why we're dedicated to giving our customers the time and attention they need when car shopping. From our expansive inventory of quality used cars, trucks, and SUVs, to our friendly and knowledgeable sales staff, your experience is sure to be the best! Stock# GP5206APrice is monthly payment estimate*980-243-3491 - Call for your custom payment planFor all details on this vehicle, visit:https://soldcars-vdp.zmotauto.com/6806914-78839 Vehicle OverviewTrim: EX sedan Mileage: 16k miles Exterior Color: Red Interior Color: gray Engine: 2.0L I4 DOHC 16V i-VTEC Drive:  Transmission: CVT VIN:  2HGFC2F70HH566878Sale Price: $19061Monthly Payment Estimate: Finance at 3.99% APR for 72 months at $269 per month with $1906 down payment. Subject to credit approval. Adjustable terms available. This estimate does not represent an actual loan offer. Please call today for your custom monthly payment plan. Vehicle subject to prior sale. All prices plus government fees and taxes, any finance charges, dealer document processing charge, any electronic filing charge, and any emission testing charge. See dealer for details. Please mention Craigslist when calling about offer. *CALL* or *TEXT* us to see how we can help you finance this Honda Civic!Mention you saw STOCK #GP5206A on Craigslist for a great deal: 980-243-3491Standard Features8 SpeakersAM/FM radioRadio data systemRadio: 180-Watt AM/FM/HD/SiriusXM Audio SystemAir ConditioningAutomatic temperature controlRear window defrosterPower steeringPower windowsRemote keyless entrySteering wheel mounted audio controlsFour wheel independent suspensionSpeed-sensing steeringTraction control4-Wheel Disc BrakesABS brakesDual front impact airbagsDual front side impact airbagsEmergency communication systemFront anti-roll bar Disclaimer: While every reasonable effort is made to ensure the accuracy of the information for this Honda Civic, we are not responsible for any errors or omissions contained in this ad. Please verify any information in question with Team Auto Group at 980-243-3491*Honda* *Civic* *Type-R* *Honda* *Civic* *VTi* *Honda* *Civic* *GTi* *Honda* *Civic* *SiR* *Honda* *Civic* *Hybrid* *Honda* *Civic* *GX* *Honda* *Civic* *Shuttle* *Honda* *Civic* *CR-X* *Honda* *Civic* *CR-X* *del* *Sol* *Honda* *Civic* *Si* *Honda* *Civic* *Concerto* *Honda* *Civic* *HF* *Honda* *Civic* *4-DR* *wagon* *Honda* *Civic* *DX* *Honda* *Civic* *5DR* *Coupe* *Hatchback* 2022  2021  2020  2019  2018  2017  2016  2015  2014  2013  2012  2011  2010  2009  2008  2007  2006  2005  2004  2003  2002  2001  2000   22  21    19  18  17  16  15  14  13  12  11  10  09  08  07  06  05  04  03  02  01  00",good,nc,2024-02-10 01:33:35,56909,active,56.62752742590224,10bd1189,13
7315601085,honda,civic,new york city,https://images.craigslist.org/00Q0Q_3hD3yT0cfRtz_0x20oM_600x450.jpg,"Engine and transmission is running excellent. No mechanical issues whatsoever! Clean title in hand, clean car fax. Great reliable vehicle for daily commuting. 4cyl engine great on gas. Feel free to call or text me at  show contact info  Jay.",excellent,ny,2024-03-23 14:04:33,161635,inactive,43.9755490239395,1a97288c,11
7307491645,jeep,wrangler,greenville / upstate,https://images.craigslist.org/00I0I_cVqfO8ePehLz_0cU09G_600x450.jpg,"2008 Jeep Wrangler Unlimited X    NO DEALER FEES - WARRANTY - FREE SHIPPING- INCLUDE STOCK # OF VEHICLE OF INTEREST WHEN YOU TEXTCall (or text) â˜ (706) 216âˆ’0175  Primary Auto Group 8425 HWY 53 E, DAWSONVILLE, GA 30534Copy & Paste the URL belowto view more information!https://www.primaryjeeps.com   			Year : 2008				Make : Jeep				Model : Wrangler				Trim : Unlimited X					Transmission : Automatic				Exterior Color : Silver				Interior Color : Dark Slate Gray/Med Slate Gray				Series : Unlimited X 					Condition : Excellent					Stock ID : A20288				Engine : 6	   > > > $18,950 < < <             Call (or text)  (706) 216âˆ’0175 for quick answers to your questions about this Jeep Wrangler Unlimited X.   ***** Jeep Wrangler Unlimited X  *****  2009, 2010, 2011, 2008, 2007, 2006, 2005, Jeep Wrangler, Grand Cherokee, Liberty, Wrangler, Commander, Compass, Patriot, Wrangler Unlimited   Disclaimer :  www.PrimaryJeep.com will never sell, share, or spam your mobile number. Standard text messaging rates may apply.      NO DEALER FEES - WARRANTY - FREE SHIPPING- INCLUDE STOCK # OF VEHICLE OF INTEREST WHEN YOU TEXTCall (or text) â˜ (706) 216âˆ’0175  Primary Auto Group 8425 HWY 53 E, DAWSONVILLE, GA 30534Copy & Paste the URL belowto view more information!https://www.primaryjeeps.com    2008 08 *Jeep* *Wrangler* *Cheap Unlimited X* 		*Like New 2008 Unlimited X * *6* 		*Must See 2008 Jeep Wrangler Unlimited X Gasoline - 		2008 Jeep Wrangler  wrangler WRANGLER Unlimited X Gasoline  Cheap -  		2008 Jeep Wrangler (Unlimited X) Carfax Gasoline 6 -  		2008 Jeep Wrangler Unlimited X  6 Gasoline  -  		Jeep Wrangler Unlimited X    		*SCHEDULE YOUR TEST DRIVE 2008 Jeep Wrangler  6 Unlimited X Gasoline *   		*Jeep* *Wrangler* 2008 Jeep Wrangler Unlimited X Gasoline    		*2008 Jeep Wrangler Unlimited X  		*Primary Auto Group* *Call (or text) us today at (706) 216âˆ’0175.* 		2009 Jeep Wrangler Unlimited X 6 - 		Have you seen this 2010 Jeep Wrangler Unlimited X  ?  		Must See 2011 Jeep Wrangler  Unlimited X Gasoline   		*For Sale Wrangler* *Wrangler* *Carfax Unlimited X Gasoline   		Come test drive this amazing *Jeep* *Wrangler* *(UNLIMITED X)* *Gasoline*  Unlimited X  Gasoline  Gasoline* 		*(Jeep)* *(Wrangler)* *Unlimited X* *6* *(GASOLINE)* *Bad Credit* 		*Gasoline* **  *Super Vehicle Gasoline Call (or text) this number (706) 216âˆ’0175* *6* *Primary Auto Group* * Good Credit* 		2008 2007 2006 2005  		*This vehicle is a used Jeep Wrangler* *No Credit* 		*It is like New Unlimited X* *6 Gasoline*  		*Gasoline* 2004 2003 2002 2001 2000 1999#ArgoXTV",excellent,sc,2023-09-07 14:03:57,124126,inactive,5.512192678951497,db9c33aa,26
7313957163,mazda,mazda6,new haven,https://images.craigslist.org/00R0R_jyDPNUjFGaSz_0ew0aT_600x450.jpg,"2013 Mazda Mazda6 4dr Sdn Auto i Sport Automatic Black Ebony Black on Black Cloth M10145  Offered by: Harbor View Auto Sales LLC 115 Jefferson St  Stamford, CT 06902 â˜Žï¸ Call 203    588   2307 www.harborviewauto.com ðŸŒŸ An Impressive 2013 Mazda Mazda6 4dr Sdn Auto i Sport with 67200 Miles. ðŸŒŸ  Color: Black Ebony Black on Black Cloth Engine: 2.5L 4 Cylinder Engine Stock number: M10145 Transmission: Automatic Body: 4dr Car Miles: 67,200  âœ”ï¸ Great opportunity to make extra $$ driving UBER, UBER EATS, LYFT, Doordash, ETC.. So check out this Low Mileage FWD Sporty 4Dr. Sedan, 2.5L 4 Cyl., 30 M.P.G., Auto, A/C, Power Windows, Power Locks, Power Mirrors, Cruise, Tilt, Well Equipped, Completely Safety Checked, CT Emissions / Inspection Ready, A Must See!! Free CarFax report as vehicle had minor damaged but repaired, (Not by us) NO Structural damage, NO Airbag Deployment NO Total Loss, CLEAN TITLE.  Specifications:  Equipments: âœ” 4 Cylinder Engine âœ” ABS âœ” 4-Wheel Disc Brakes âœ” 5-Speed A/T âœ” A/C view more at harborviewauto.com/s/NYX082  Mechanical: âœ” 2.5L DOHC MPFI 16-valve I4 engine -inc: variable valve timing (VVT) âœ” 5-speed sport automatic transmission w/OD & manual mode âœ” Chrome exhaust finishers âœ” Front wheel drive âœ” Front/rear stabilizer bars view more at harborviewauto.com/s/NYX082  Exterior: âœ” 16"" x 4.0"" temporary spare wheel âœ” 16"" x 6.5"" steel wheels âœ” Body-color door handles âœ” Body-color grille âœ” Body-color pwr mirrors view more at harborviewauto.com/s/NYX082  Interior: âœ” (2) 12-volt pwr outlets âœ” (2) coat hooks âœ” (2) front & (2) rear cupholders âœ” (2) retractable keys âœ” (3) passenger assist grips view more at harborviewauto.com/s/NYX082  Safety: âœ” 3-point seat belts for all positions âœ” 4-wheel anti-lock brake system (ABS) w/electronic brakeforce distribution (EBD) âœ” Child safety rear door locks âœ” Dual front airbag supplemental restraint system (SRS) âœ” Dynamic stability control (DSC) view more at harborviewauto.com/s/NYX082  PLEASE REPLY TO THIS AD TO GET MORE INFORMATION ABOUT THIS VEHICLE OR â˜Žï¸ Call 203    588   2307 OR  Visit harborviewauto.com/s/NYX082 âœ”ï¸ *PLEASE NOTE LISTED PRICE REFLECTS A  CASH or TRADE DOWN PAYMENT*-----REMEMBER CA$H IS ALWAYS KING!!!!!            TEXT or call directly at (203) 893-2059-----But if you do need ""SPECIAL FINANCING"", we can definitely help. Bad credit, Slow credit, No credit, NO PROBLEM - 1000% GUARANTEED CREDIT APPROVAL!!!!-----   ***ALL YOU NEED: PROOF OF INCOME, like Pay stubs, 2 Months Bank Statements, Social Security Income, Disability, Pensions, Verifiable Company Letterhead O.K., etc..,TAX ID # O.K.*** (Plus a few other things but NO Big deal)-----                                                                                                                                                     Please note all loans WILL get reported to the credit agencies in order to help establish or re-establish your credit. (NOT A BUY-HERE-PAY HERE)-----Most vehicles include warranty for 24 months/24,000 miles included in your payments when financed through C.A or other selected lenders.-----Most payments are very affordable between $49 - $89 per week with down payments between $1500 - $3000----- THE MORE DOWN PAYMENT, THE MORE YOU $AVE! (Extra $1000 down payment could mean additional $1000 saving off the listed price)-----If you like a vehicle but don't have all of the down payment right away give us a call and we'll work something out, WE ARE HERE TO HELP!-----We handle EVERYTHING: New Registration, Transfer Registration, Title, License Plates, and can even assist with Auto Insurance. (ONE STOP SHOP!)-----And to our ""GREAT"" credit customers, (usually 720 or better) we have interest rates as low as 1.9% and 72 month financing available.-----Make Extra $$ with Uber, Uber Eats, LYFT, Etc... and help pay for your vehicle. (Drive just 1 day a week and say you earn $75 a day x 4 = $300 per month additional income, think that will help with your payments?? -----  Disclaimer: Please confirm the accuracy of the specifications provided above with the dealer's representative. Neither the dealer nor the provider of the information is responsible for misprints or other errors regarding this data. Mileage information is based on an EPA rating at the time the vehicle was manufactured. Actual mileage will vary with options, driving conditions, driving habits, and vehicle's condition.  5df84704-2443-45a5-928e-fc830051d34d  3.6.9",good,ct,2023-10-24 15:23:34,164521,inactive,50.49660397835575,1a97288c,8
7308205625,chevrolet,lifted silverado 2500,yakima,https://images.craigslist.org/00a0a_7R2hfZ8PegKz_0jm0ew_600x450.jpg,"2018 Chevrolet Silverado 2500 HD LTZ 4x4 **Clean Carfax One Owner Lifted 4x4 Diesel Truck With Backup Camera!**  WANT TO FIND OUT MORE ABOUT THIS VEHICLE? Copy the link below and paste it into your browser:  https://www.nwmsrocks.com/i/126381  ðŸ“± or Text ""83420"" to 509-412-3404     We've got experts standing by for you, call 509-412-3404 and mention stock # 83420     ðŸ—º Northwest Motorsport now has 11 locations across Washington!  For a list of our locations ðŸ“± Text ""location"" to 509-412-3404 or visit: https://www.nwmsrocks.com/locations  Just copy and paste the link above in your address bar!      ðŸš˜Northwest Motorsport is the largest independent vehicle dealership on the west coast, specializing in our signature lifted, custom, and diesel trucks! Our inventory includes hundreds of 5.9L Cummins Diesels, 7.3L Powerstroke Diesels, Duramax Diesels, Lifted trucks, custom trucks, manual trucks, stock trucks and everything in between including this *Diesel* *Chevrolet* *Silverado*! While Northwest Motorsport is best known for Trucks, Trucks, and more Trucks, our unmatched inventory provides hundreds of cars and SUVs to choose from! If you are looking for your next dream vehicle, make your first stop Northwest Motorsport.    STOCK: 83420  YEAR: 2018  MAKE: Chevrolet  MODEL: Silverado 2500 HD LTZ 4x4  PRICE: Call or text 509-412-3404 for the Lowest Price!  MILES: 53,774  ENGINE: 6.6L V8 OHV 32V DURAMAX TURBO DIESEL  FUEL: Diesel  TRANSMISSION: Automatic  EXTERIOR COLOR: White  INTERIOR COLOR: Black    Because we have locations all over Washington we transport vehicles between the locations. Craigslist does not let us update the vehicle's location once we've posted it. To get a last known location of this vehicle ðŸ“± Text ""83420"" to 509-412-3404 and we'll send back details on the vehicle's location. We don't want you driving to one of our lots and not finding the vehicle you're looking for!  Exterior/BodyLifted, Tinted Glass, Backup Camera, Signal Mirrors, Rear Defrost, Trailer Brakes, Sunroof/MoonroofInterior/DashTilt Steering, Telescoping Steering Wheel, Interior Wood Trim, Trip Odometer, Leather Wrapped Steering Wheel, Digital Dash, Console, AM/FM Radio, Clock, Cruise Control, Air Conditioning, Steering Wheel Audio Controls, Bluetooth, DVD Entertainment System, DVD Player, Compact Disc Player, Heated Steering Wheel, Premium Sound PackageSeatingRear Shoulder Harness, Center Arm Rest, Leather Seats, Bucket Seats, Heated Seats, Air Condition SeatsPower OptionsPower Windows, Power Mirrors, Power Door Locks, Power Steering, Power Driver Seat, Power Memory Driver Seat, Power Passenger Seat, Power Adjustable PedalsTruck OptionsRunning Boards, Sliding Rear Window, Tonneau Cover, Tow PackageCustomizationsFog/Driving Lamps, Body Side MoldingDrivetrain/BrakesAlloy Wheels, 4 Wheel Drive, Automatic Transmission, Premium Wheels, Turbo     ðŸ˜ƒThousands of Positive ReviewsBuy from a Trusted Dealership  BBB: â­â­â­â­â­ A+ Rating DealerRater: â­â­â­â­â­ 4.9 Rating - 9,473 reviews Google: â­â­â­â­â­ 4.5 Rating - 560 reviews Cars.com: â­â­â­â­â­ 4.9 Rating - 9,803 reviews    âœ… Bad Credit? âœ… No Credit? âœ… First Time Buyer? We've got you covered! We work with dozens of Lenders to get you approved quickly! https://www.nwmsrocks.com/finance  Copy and paste the above link into your address bar to get Pre-Approved!      â—Trade-Ins are WELCOME! ðŸ’µ We buy Trucks, Cars, SUVs, Vans, and Recreational Vehicles. If it has an engine let us put a bid on it!  Dealership Hours   Monday: 9AM-8PM Tuesday:  9AM-8PM Wednesday: 9AM-8PM Thursday: 9AM-8PM Friday: 9AM-8PM Saturday: 9AM-8PM Sunday: 10AM-7PM    Vehicle Disclaimer:  All vehicles are one of each. All vehicles are Used. A dealer documentary service fee of up to $150 may be added to the sale price or capitalized cost. All offers expire on close of the business day subject content is removed from the website, and all financing is subject to credit approval. Prices exclude tax, title, and license. All transactions are negotiable including price, trade allowance, interest rate (of which the dealer may retain a portion), term, and documentary service fee. Any agreement is subject to the execution of contract documents. Every reasonable effort is made to ensure the accuracy of this data. Please verify any information in question with a dealership sales representative. Financing rates are OAC. Please see dealer website for disclaimers: https://www.nwmsrocks.com/disclaimers    Chevrolet Silverado Clean Carfax One Owner Lifted 4x4 Diesel Truck With Backup Camera! 2500 HD LTZ 4x4  83420,1GC1KWEY8JF282628,2018,6.6l v8 ohv 32v duramax turbo diesel,6.6l,6.6 liter,lifted,jacked up,8 cylinder,2500,hd,ltz,4x4,truck,crew cab,chevrolet,chevy,chevrolet silverado,silverado,leather,leather interior,white,white chevrolet,white chevrolet silverado,diesel,automatic,automatic chevrolet,automatic chevrolet silverado,3/4 ton,three quarter ton,pasco,wa,lift kit,tinted glass,backup camera,trailer brakes,4 wheel drive,turbo,sliding rear window,tonneau cover,tow package,power steering,power memory driver seat,leather seats,bucket seats,sunroof/moonroof,cruise control,dvd entertainment system,dvd player,heated seats,air condition seats,heated steering wheel,trucks,lifted trucks,diesel trucks,duramax diesel trucks,chevy trucks,lifted chevy trucks,3/4 ton trucks,1 owner vehicles,lifted white trucks,one owner vehicles,v8 trucks,lifted diesel trucks,delivery vehicles,crew cab trucks ,northwest motorsport,nwms,nwmsrocks,  -  -  -  -",good,wa,2024-05-15 02:49:40,170290,active,6.2730993631008065,34a358d4,17
7302062768,alfa-romeo,romeo giulia sedan 4d,visalia-tulare,https://images.craigslist.org/01212_9YGV5SROgpgz_0gw0co_600x450.jpg,"Carvana is the safer way to buy a car During these uncertain times, Carvana is dedicated to ensuring safety for all of our customers. In addition to our 100% online shopping and selling experience that allows all customers to buy and trade their cars without ever leaving the safety of their house, weâ€™re providing touchless delivery that make all aspects of our process even safer. Now, you can get the car you want, and trade in your old one, while avoiding person-to-person contact with our friendly advocates. There are some things that canâ€™t be put off. And if buying a car is one of them, know that weâ€™re doing everything we can to keep you keep moving while continuing to put your health safety, and happiness first. Vehicle Stock# 2000862279ðŸ“± Want to instantly check this carâ€™s availability? Call us at  559-384-1811Just text that stock number to 855-976-4304 or head to http://www.carvanaauto.com/6674545-74722 and plug it into the search bar!Get PRE-QUALIFIED for your auto loan in 2 minutes - no hit to your credit:http://finance.carvanaauto.com/6674545-74722Looking for more cars like this one? We have 44 Alfa Romeo Giulia in stock for as low as $23990!Why buy with Carvana? We have one standard: the highest. Take a look at just some of the qualifications all of our cars must meet before we list them.150-POINT INSPECTION: We put each vehicle through a 150-point inspection so that you can be 100% confident in its quality and safety. See everything that goes into our inspections at:http://www.carvanaauto.com/6674545-74722NO REPORTED ACCIDENTS: We do not sell cars that have been in a reported accident or have a frame or structural damage.7 DAY TEST OWN MONEY BACK GUARANTEE: Every Carvana car comes with a 7-day money-back guarantee. Why? It takes more than 15-minutes to make a decision on your next car. Learn more about test owning at http://about.carvanaauto.comFLEXIBLE FINANCING, TRADE INS WELCOME: Weâ€™re all about real-time financing without the middle man. Need financing? Pick a combination of down and monthly payments that work for you. Have a trade-in? Weâ€™ll give you a value in 2 minutes. Check out everything about our financing at:http://finance.carvanaauto.com/6674545-74722COST SAVINGS: Carvana's business model has fewer expenses and no bloated fees compared to your local dealership. See how much we can save you at http://about.carvanaauto.comPREMIUM DETAIL: We go the extra mile so that your car is looking as good as new. There are a lot of specifics that we wonâ€™t list here (we wash, clean, buff, paint, polish, wax, seal), but trust us that when your car arrives, itâ€™s going to look sweet.Vehicle Info for Stock# 2000862279Trim: Sedan 4D sedanMileage: 2k milesExterior Color: BlackInterior Color: REDEngine: Drive: rwdTransmission: VIN: ZARFAMAN7L7629796Dealer Disclosure: Price excludes tax, title, and registration (which we handle for you).Disclaimer: You agree that by providing your phone number, Carvana, or Carvanaâ€™s authorized representatives*, may call and/or send text messages (including by using equipment to automatically dial telephone numbers) about your interest in a purchase, for marketing/sales purposes, or for any other servicing or informational purpose related to your account. You do not have to consent to receiving calls or texts to purchase from Carvana. While every reasonable effort is made to ensure the accuracy of the information for this Alfa Romeo Giulia, we are not responsible for any errors or omissions contained in this ad. Please verify any information in question with Carvana at 559-384-1811*Including, but not limited to, Bridgecrest Credit Company, GO Financial and SilverRock Automotive.*Alfa* *Romeo* *Giulia* 2022  2021  2020  2019  2018  2017  2016  2015  2014  2013  2012  2011  2010  2009  2008  2007  2006  2005  2004  2003  2002  2001  2000   22  21    19  18  17  16  15  14  13  12  11  10  09  08  07  06  05  04  03  02  01  00",good,ca,2023-12-10 21:17:12,97062,active,34.594163324244974,59def556,26
7302861361,mercedes-benz,benz,norfolk / hampton roads,https://images.craigslist.org/00q0q_lqnBuI0fEvjz_0lM0t2_600x450.jpg,I have a 2006 ml500 it has 170000 miles on it v8 engine all good on car runs an drives but not for to long because it has to have heater core replaced in front bumper replaced will need tow it will start right up in driver side tire is flat 3000 obo,good,va,2024-04-25 16:18:13,146898,active,48.35550828810835,ea0e89f7,24
